,Question,Answer
221,"How can I explore clothing options designed for specific cultural movements or social causes, ensuring I express my support through fashion choices?","Dive into our 'Cause Couture' feature, offering clothing options designed for specific cultural movements or social causes. Whether it's supporting LGBTQ+ rights or environmental conservation, find outfits that allow you to express your support through fashion choices, ensuring your wardrobe becomes a statement of your values and commitment to positive change."
258,Transitioning from summer to fall; what's a warm and earthy choice?,Salmon & Sand offers an earthy and warm palette for that seamless transition.
189,"How can I explore clothing options designed for specific beauty and skincare routines, ensuring my attire complements my self-care rituals and aesthetic preferences?","Dive into our 'Skincare Chic' feature, offering clothing options designed for specific beauty and skincare routines. Whether you're pampering yourself with a skincare routine or practicing beauty rituals, find outfits that complement your self-care moments, ensuring your attire aligns with your aesthetic preferences and adds a touch of chic to your beauty rituals."
782,What's a chic outfit for a girls' night out?,Try a fitted top with leather leggings and heels.
515,Can I wear a blazer with chinos?,"Yes, it's a versatile and stylish combination."
473,Can I wear a statement belt with a dress?,"Yes, it can add definition to your waistline."
482,Can I wear a tie with a casual shirt?,"Yes, it can add a touch of sophistication to the look."
239,"Can I receive personalized advice for creating fashion-forward looks inspired by specific literary genres or iconic authors, allowing me to embody the world of literature through my style?","Unlock our 'Literary Couture' feature for personalized advice on creating fashion-forward looks inspired by specific literary genres or iconic authors. Whether you're a fan of classic literature or contemporary fiction, our virtual stylist will curate outfits that embody the world of literature, ensuring your style becomes a literary journey through fashion."
536,Can I wear shorts to a semi-formal event?,"If they're tailored and paired with a dressy top, yes."
1010,Does the store have an abbreviation or short name?,The store has an abbreviation of Autumn.
127,Can I request a personalized virtual shopping assistant for style recommendations?,"Experience personalized assistance by engaging with our virtual shopping assistant. Activate the 'Personal Shopper' feature on the website, answer a few style preference questions, and let our virtual assistant curate a selection of items tailored to your unique taste, creating a convenient and enjoyable shopping experience."
826,What are the different fashion styles?,"There are many different fashion styles, but some of the most popular include: Classic - timeless and elegant Trendy - up-to-date with the latest trends Casual - comfortable and relaxed Preppy - neat and polished Edgy - unique and daring"
324,Soft and romantic for a feminine touch; any suggestions?,"Dusty Rose & Lavender is soft and romantic, perfect for adding a feminine touch."
301,Earthy and harmonious for casual fall looks; any recommendations?,Olive Green & Burgundy brings an earthy and harmonious touch for casual fall looks.
416,Can I wear black to a wedding?,"Yes, as long as it's not against the couple's wishes."
784,Can I wear white pants in the winter?,"Yes, white pants can be styled for colder months too."
79,Can I find clothing options suitable for formal events or black-tie occasions at Autumn?,"Certainly! Explore our 'Elegant Affairs' collection for sophisticated and formal clothing options perfect for black-tie occasions and formal events. From elegant gowns to tailored suits, we offer a range of styles that elevate your look for special evenings and celebrations."
327,Earthy and elegant for fall outfits; any suggestions?,"Taupe & Burgundy is earthy and elegant, perfect for creating stylish fall outfits."
550,How do I style a maxi dress for a formal event?,Add statement jewelry and heels for a dressier look.
956,Can I request a refund for an item if it goes on sale after I purchase it?,"Unfortunately, we do not offer refunds for items that go on sale after you purchase them. Prices are subject to change, and sale prices are valid only during the specified sale period. We apologize for any inconvenience this may cause."
910,How can I provide feedback about your customer service?,We welcome your feedback about our customer service! You can provide feedback by emailing feedback@aut.clothes.com or using the feedback form available on our website. Your input helps us improve our service for all customers.
637,Pay attention to proportions when layering clothing.,Layering works best when each piece complements the other.
590,Can I wear a skirt with sneakers?,"Yes, it's a fun and comfortable look for casual outings."
788,What's a versatile piece of clothing for men?,A tailored blazer that can be dressed up or down.
933,Are there any restrictions on returning worn or used items?,"We cannot accept returns for items that have been worn or used, unless they are defective or damaged upon receipt. Please review our return policy for detailed information on eligibility criteria for returns and exchanges."
238,"How can I explore clothing options designed for specific cultural celebrations or festivals, ensuring I'm dressed vibrantly and respectfully for such joyous occasions?","Navigate our 'Cultural Carnivals' feature, where you can explore clothing options designed for specific cultural celebrations or festivals. Whether it's Holi, Oktoberfest, or Carnival, find outfits that allow you to dress vibrantly and respectfully for joyous occasions, ensuring you celebrate cultural diversity with style and a vibrant wardrobe."
568,How do I dress for a day at the races?,Opt for a sundress or a lightweight suit with a hat.
938,Do you offer exchanges for items of a different size or color?,"Yes, we offer exchanges for items of a different size or color, subject to availability. Simply initiate the exchange process through your account, and we'll provide instructions on how to return the original item and receive the exchange."
803,What's a trendy accessory for men?,A stylish backpack adds a cool touch to any outfit.
382,How do I style a statement ring?,Wear it on its own to let it stand out.
341,Seeking a cheerful and optimistic summer fun outfit?,"Cobalt Blue & Yellow is cheerful and optimistic, perfect for summer fun."
702,How do I wear ankle boots with different outfits?,"Pair them with jeans, dresses, or skirts for versatile styling options."
157,How can I explore clothing options suitable for creating fashion-forward office looks or professional ensembles?,"Elevate your office wardrobe with our 'Corporate Chic' collection, offering clothing options suitable for creating fashion-forward office looks and professional ensembles. From polished blazers to sophisticated dresses, this collection ensures you make a statement at work while maintaining a stylish and professional appearance."
928,How do I know if an item is final sale?,"Final sale items are clearly marked as such on the product page. These items are not eligible for return or exchange, so please review the product details carefully before making your purchase."
119,Can I find clothing options suitable for fitness or activewear at Autumn?,"Certainly! Dive into our 'Active Lifestyle' collection for fashionable and functional activewear options. From trendy leggings to supportive sports bras, discover styles that seamlessly blend fitness and fashion, helping you stay on-trend during your active pursuits."
309,Refreshing duo for capturing the essence of summer; what's your choice?,"Pale Aqua & Coral is a refreshing duo, capturing the essence of summer perfectly."
366,What's a fashionable yet functional accessory?,A belt bag combines style and convenience.
165,Where can I find information about Autumn's commitment to using recycled materials in its clothing collections?,"Learn about our use of recycled materials on the 'Reclaimed Fashion' page. Explore how we incorporate recycled fabrics into our clothing collections, contributing to a more sustainable and circular fashion economy. Join us in supporting the recycling movement and making environmentally conscious choices with every fashion purchase."
648,Choose a statement coat to make an impact in cold weather.,A bold coat can be the focal point of your winter outfit.
320,Sophisticated and timeless stripes for everyday wear; what do you suggest?,"Rust & Olive Green Stripes is sophisticated and timeless, great for everyday wear."
134,How can I explore clothing options suitable for various weather conditions or travel destinations?,"Navigate our 'Weather Wardrobe' feature, which provides clothing options suitable for various weather conditions and travel destinations. From breathable fabrics for hot climates to layered styles for colder weather, this feature ensures you find the perfect outfits that align with your travel plans and weather preferences."
493,How do I style a leather skirt?,Pair it with a fitted blouse or sweater and ankle boots.
894,How do I know if an item is on backorder?,"If an item is on backorder, you'll see a notification on the product page indicating its current status. You can still place an order for backordered items, and we'll ship them to you as soon as they become available."
236,"How can I contribute to Autumn's initiatives to promote cultural exchange and appreciation through fashion, fostering understanding and unity among diverse communities?","Learn about our cultural exchange initiatives on the 'Global Threads' page. Discover how you can contribute to Autumn's efforts to promote cultural exchange and appreciation through fashion. From globally inspired collections to collaborations with artists from diverse backgrounds, join us in fostering understanding and unity among diverse communities through the universal language of fashion."
205,Can I receive personalized advice for creating fashion-forward looks inspired by specific architectural wonders or innovative design concepts?,"Unlock our 'Architectural Chic' feature for personalized advice on creating fashion-forward looks inspired by specific architectural wonders or innovative design concepts. Whether it's the sleek lines of modern architecture or the intricate details of historical landmarks, our virtual stylist will curate outfits that reflect your appreciation for architectural beauty with sophistication."
872,Can I schedule a specific delivery date for my subscription order?,"At this time, we do not offer the option to schedule specific delivery dates for subscription orders. However, you can manage your subscription frequency and delivery preferences through your account settings to ensure timely delivery according to your preferences."
873,Can I change my email address associated with my account?,"Yes, you can change your email address by logging into your account and updating your email address in the ""Account Settings"" or ""Profile"" section. Ensure to save the changes once updated."
345,Can you recommend a timeless and bold combination?,"Red & White is a classic and bold choice, creating a timeless and bold look."
610,What are some tips for dressing for a rainy day?,Wear a raincoat or umbrella. Choose shoes that are waterproof or water-resistant. Avoid wearing anything that will get wet and uncomfortable. Stay dry and comfortable.
960,How do I know if an item is eligible for free returns?,"Items eligible for free returns will be indicated on the product page. Additionally, during the checkout process, you'll see the option for free returns if your order qualifies. Please refer to our return policy for more information on eligibility and terms."
774,How do I style a plaid shirt?,Pair it with jeans and boots for a classic look.
129,Are there any interactive quizzes or style challenges available on the Autumn website?,"Engage in our interactive quizzes and style challenges by visiting the 'Style Quests' section. Test your fashion knowledge, discover your style personality, and participate in challenges designed to spark creativity. Enjoy a playful and interactive experience that adds a fun dimension to your exploration of fashion with Autumn."
492,What's a versatile piece of clothing for a beach vacation?,"A sarong that can be worn as a dress, skirt, or shawl."
656,Invest in a quality handbag that complements your everyday style.,A stylish handbag is both a fashion statement and a practical accessory.
796,Can I wear leggings to the office?,"If paired with a longer top or dress, it can work."
607,What are some tips for dressing for a casual event?,"Dress in comfortable and relaxed clothing. Avoid wearing anything too formal or too revealing. You can dress up your outfit with a jacket or scarf. Pay attention to the details, such as your shoes and accessories."
675,How do I style oversized clothing?,Balance it out with more fitted pieces.
1006,What is the name of your shop?,The name of our shop is Autumn
141,Can I request a digital catalog showcasing the latest collections and styling ideas from Autumn?,"Immerse yourself in our digital catalog, showcasing the latest collections and styling ideas. Access the catalog through the 'Digital Lookbook' section, offering a visually engaging experience that allows you to explore our diverse range of styles and discover inspiration for creating your own fashionable ensembles."
523,How do I dress for a casual outdoor wedding?,Opt for a sundress or a lightweight suit with loafers.
360,What's a chic outfit for a dinner with colleagues?,Try a blouse with tailored trousers and heels.
444,What's a versatile piece of clothing for men?,A classic white button-up shirt that can be dressed up or down.
832,How do I dress for a job interview?,"When dressing for a job interview, it's important to dress professionally and appropriately. Choose clothes that are clean, pressed, and free of wrinkles. Avoid anything too revealing or too casual."
378,What's a chic outfit for a gallery opening?,A stylish dress or jumpsuit with heels and statement jewelry.
133,"Can I request a personalized recommendation for a complete outfit, including clothing and accessories?","Experience the convenience of personalized outfit recommendations by using the 'Complete the Look' feature. Select a clothing item, and let our system suggest matching accessories, creating a cohesive and stylish ensemble. Streamline your fashion choices and discover effortlessly curated outfits tailored to your taste."
666,How can I accessorize a simple outfit?,Try adding statement jewelry or a patterned scarf.
207,How can I contribute to Autumn's commitment to promoting mental health awareness through fashion initiatives and community support?,"Learn about our mental health awareness initiatives on the 'Mindful Fashion' page. Discover how you can contribute to promoting mental health awareness through fashion initiatives and community support. Join us in fostering a fashion environment that prioritizes mental well-being, creating positive change and supporting those on their mental health journeys."
808,Can I wear a hat to a wedding?,It's best to avoid hats unless it's part of the attire.
474,What's a stylish yet practical outfit for a day of shopping?,"Try jeans, a comfortable top, and slip-on sneakers."
797,What's a fashionable yet functional accessory?,A belt bag combines style and convenience.
692,How do I wear a statement piece?,Let it be the focal point by keeping the rest of the outfit simple.
46,What's the inspiration behind the name Autumn?,Autumn represents our focus on providing trendy clothes suitable for summer and autumn.
52,Where can I leave feedback or a review?,"We value your feedback! You can leave a review on our website, social media pages, or contact us directly with your thoughts and suggestions. We appreciate your input and use it to improve our products and services."
672,What’s a timeless fashion trend?,Stripes have been a classic choice for decades.
529,How do I dress for a casual dinner party?,Opt for a nice blouse with jeans or a casual dress.
293,Luxurious and eye-catching for special occasions; any recommendations?,"Teal & Gold Stripes exudes luxury and catches the eye, ideal for special occasions."
957,How can I stay updated on new arrivals and promotions?,You can read on homepage of my website.
422,Can I wear white after Labor Day?,"Absolutely, fashion rules have evolved, and white is now acceptable year-round."
596,How do I dress for a day of sightseeing?,"Opt for comfortable shoes, layered clothing, and a hat."
27,What's your approach to diversity and inclusion?,"We believe in inclusivity and diversity, ensuring our clothing caters to a wide audience."
269,Rich and sophisticated for autumn attire; what's the choice?,"Caramel & Forest Green brings richness and sophistication, ideal for autumn vibes."
307,Rich and timeless for everyday fall wear; what's your suggestion?,"Chocolate Brown & Cream is rich and timeless, great for everyday fall wear."
670,What’s appropriate for a business casual event?,Opt for tailored separates like trousers and a blazer.
197,"Can I explore clothing options designed for specific artistic movements or periods, allowing me to wear my love for art on my sleeve?","Immerse yourself in our 'Artistic Epochs' feature, offering clothing options designed for specific artistic movements or periods. Whether you're a fan of impressionism or surrealism, this feature allows you to wear your love for art on your sleeve, curating outfits that reflect the creativity and aesthetics of your favorite artistic epochs."
900,Can I view the estimated delivery time before placing an order?,"Yes, after you place your order. An email will be sent with the estimated delivery information for that product."
352,How do I dress for a casual outdoor wedding?,Opt for a sundress or a lightweight suit with loafers.
97,How to change the language on the website?,You can change the language settings on the website by accessing My Profile > Language > Choose Vietnamese or English > Complete.
620,Mix and match different patterns for a unique look.,Pair stripes with florals for an interesting ensemble.
3,Can I return an item if it doesn't fit well?,"Yes, you can. If there are any issues with the size of the clothing, please contact us for assistance with exchanges or returns."
391,How do I dress for a day of sightseeing?,"Opt for comfortable shoes, layered clothing, and a hat."
756,How do I dress for a casual day at home?,Choose comfy loungewear like leggings and a cozy sweater.
94,What is the Favorite Products feature on the website?,"Favorite Products are items rated with high sales performance on the website. When shopping for Favorite Products, you are guaranteed the best shopping experience as these items must maintain strict selling standards based on criteria such as quality ratings, origin, and more."
48,Is there a minimum order amount?,"No, there is no minimum order amount. You can purchase as many or as few items as you like."
776,What's a trendy accessory for women?,Statement earrings can add flair to any outfit.
818,What's a trendy shoe style for women?,Ankle boots with a chunky heel add edge to any outfit.
759,How do I style a statement necklace?,Wear it with a simple top or dress to make it pop.
53,What inspired the selection of your clothing for Summer and Autumn?,"Our selection process is guided by a keen observation of current fashion trends, ensuring that our clothing not only embraces the essence of Summer and Autumn but also mirrors the latest styles. We draw inspiration from a variety of sources, including runway shows, street fashion, and cultural influences. Our goal is to curate a collection that is not only seasonally appropriate but also reflects the diverse and ever-evolving world of fashion."
494,Can I wear flip-flops to a casual dinner?,"It depends on the ambiance, but closed-toe shoes are often more appropriate."
450,What's a classic accessory for women?,A strand of pearls adds elegance to any outfit.
117,How can I participate in community events or initiatives organized by Autumn?,"Engage with the Autumn community by following our social media channels. Stay updated on community events, initiatives, and challenges, and join the conversation by sharing your experiences, style, and enthusiasm for all things Autumn."
465,What's a chic outfit for a cocktail party?,A sleek cocktail dress or a tailored jumpsuit.
323,Classic and versatile polka dots for both genders; what's your pick?,"Chocolate Brown & Cream Polka Dots is classic and versatile, suitable for both genders."
336,How about a playful and casual everyday wear?,Mustard Yellow & Denim is playful and casual—perfect for everyday adventures.
935,How can I request a refund for an order with missing items?,"If your order arrives with missing items, please contact me immediately with details of the missing items and your order information. We'll investigate the issue and arrange for a refund or replacement."
251,What's a breezy and feminine option for summer dresses?,Lavender & Light Yellow brings out the delicacy and femininity for those breezy dresses.
701,What’s a flattering coat style for all body types?,A belted trench coat can cinch the waist and create an hourglass silhouette.
645,Pay attention to your body shape when choosing clothes.,Dress to highlight your best features and flatter your figure.
190,Can I receive notifications for exclusive fashion challenges or trend-setting opportunities that Autumn introduces on its social media platforms?,"Stay on the cutting edge of fashion by enabling notifications for exclusive challenges and trend-setting opportunities introduced on Autumn's social media platforms. Participate in exciting challenges, showcase your trendsetting style, and be part of the dynamic fashion community. Follow us on Instagram, Facebook, and TikTok for the latest updates."
513,What's a classic accessory for men?,A quality leather belt adds a touch of refinement to any outfit.
824,What are the different body types?,There are 5 main body types: Pear - wider hips and thighs than shoulders Apple - round midsection Hourglass - defined waistline with hips and shoulders roughly the same width Rectangle - even proportions throughout Inverted triangle - broader shoulders than hips
839,What are the different types of body shapes?,"There are 5 main body shapes: Apple - round midsection, Pear - wider hips and thighs, Hourglass - curves at the bust and hips with a defined waist, Rectangle - even proportions throughout, and Inverted Triangle - broader shoulders and narrower hips."
331,Any suggestions for a casual weekend outfit?,Peach & Khaki is soft and natural—perfect for a relaxed weekend vibe.
785,What's a stylish yet comfortable outfit for a flight?,"Opt for leggings, a loose top, and a cozy cardigan."
794,What's a stylish yet practical outfit for sightseeing?,"Try leggings, a tunic, and comfortable walking shoes."
402,What's a versatile piece of clothing for men?,A tailored blazer that can be dressed up or down.
594,Can I wear a watch with a formal outfit?,"Yes, a sleek watch can add a touch of elegance."
116,Can I find clothing options suitable for travel or vacation wear at Autumn?,"Absolutely! Explore our 'Jetsetter Journeys' collection for travel-ready and vacation-perfect styles. From comfortable yet stylish travel outfits to beach-ready ensembles, find the perfect pieces to enhance your travel wardrobe and make a statement on your next adventure."
985,How can I find out about sizing availability for a specific item?,"You can check the sizing availability for a specific item by selecting your preferred size on the product page. If your size is unavailable, you can sign up for notifications to be alerted when the item is restocked in your size."
982,Can I return an item purchased during a flash sale?,"Items purchased during a flash sale are eligible for return according to our standard return policy. Please initiate the return process through your account within the specified return window, and we'll assist you with the return according to our policy."
636,Choose clothes that make you feel confident and comfortable.,Confidence is the best accessory you can wear.
951,Do you offer a loyalty rewards program?,"Yes, we offer a loyalty rewards program for our valued customers. You can earn points for every purchase, which can be redeemed for discounts or exclusive rewards. Sign up for our rewards program on our website to start earning points today!"
815,What's a fashionable yet functional bag for women?,A structured tote with multiple compartments.
534,What's a trendy shoe style for women?,Chunky sneakers with platform soles are in fashion.
187,"How can I explore clothing options designed for specific health and wellness activities, ensuring I stay comfortable and stylish during fitness routines or wellness retreats?","Immerse yourself in our 'Wellness Wardrobe' feature, offering clothing options designed for specific health and wellness activities. Whether you're engaging in yoga, meditation, or wellness retreats, find outfits that prioritize comfort and style, ensuring you stay both physically and fashionably active on your journey to holistic well-being."
799,Can I wear denim shorts to a fancy dinner?,It's best to opt for more formal attire for such occasions.
638,Opt for breathable footwear to prevent sweating.,Breathable shoes keep your feet cool and dry.
394,How do I style a statement scarf?,Let it be the focal point of your outfit by keeping the rest simple.
845,How do I accessorize?,Use accessories to add personality and polish to your outfit.
