,Question,Answer
202,How can I contribute to Autumn's philanthropic endeavors by supporting fashion initiatives that give back to the community?,"Learn about our philanthropic endeavors on the 'Fashion with Purpose' page. Discover how you can contribute by supporting fashion initiatives that give back to the community. From charitable collaborations to community-driven projects, join us in making a positive impact through fashion and promoting social change."
814,Can I wear white sneakers in the winter?,"Yes, white sneakers can be styled for colder months too."
457,How do I style a statement ring?,Wear it on its own to let it stand out.
980,How can I find out about career opportunities at Autumn?,"Career opportunities at Autumn are posted on our website's careers page. You can view available positions, job descriptions, and application instructions online. We're always looking for talented individuals to join our team, so check back regularly for updates."
478,How do I dress for a casual dinner party?,Opt for a nice blouse with jeans or a casual dress.
56,Can I expect more variety in the clothing options offered in the coming months?,"Absolutely! We are dedicated to providing you with a dynamic and ever-evolving collection. Stay tuned for an exciting array of new styles, trends, and seasonal releases in the coming months. Our commitment to offering a diverse range of clothing options means you'll always find something fresh and on-trend every time you visit our online store."
110,How can I view and manage my order history on the website?,"Access your order history by logging into your account and visiting the ""Order History"" section. Track past purchases, view order details, and even reorder your favorite items with ease for a convenient and organized shopping experience."
177,Can I receive personalized advice for creating fashion-forward looks inspired by literature or literary characters?,"Immerse yourself in our 'Literary Luxe' feature for personalized advice on creating fashion-forward looks inspired by literature or literary characters. Whether it's Jane Austen's timeless elegance or the bold style of modern heroines, our virtual stylist will curate outfits that bring your favorite literary worlds to life in a fashionable way."
193,"Can I receive advice on creating fashion-forward looks for specific hobbies or niche interests, such as gaming or cosplay?","Immerse yourself in our 'Niche Chic' collection, offering advice on creating fashion-forward looks for specific hobbies or niche interests, from gaming enthusiasts to cosplay lovers. Find outfits that seamlessly blend your passion for niche interests with your fashion sense, ensuring you stand out with style in communities that resonate with your unique hobbies."
400,How do I style a jumpsuit for evening wear?,Add statement jewelry and heels to elevate the look.
379,How do I dress for a day at the beach?,Wear a swimsuit with a cover-up and flip flops.
372,What's a trendy accessory for men?,A stylish backpack adds a cool touch to any outfit.
303,Rustic and cheerful for autumn walks; any suggestions?,"Mustard Yellow & Brown has a rustic and cheerful feel, perfect for autumn walks."
43,What's your policy on canceling back-ordered items?,"If an item is on back order, you can cancel it before it's shipped. Here is the Back-Ordered Item Cancellation Process:

1.Log in to your account on our website.
2.Go to the ""Order History"" or ""Back-Ordered Items"" section.
3.Identify the back-ordered item you want to cancel.
4.Click on the ""Cancel"" or ""Cancel Back-Order"" button next to the item.
5.Confirm the cancellation request.
6.If applicable, provide a reason for canceling (optional).
7.You will receive a confirmation email once the cancellation is processed.
8.The refunded amount will be returned to your original payment method."
729,What's a versatile piece of clothing for traveling?,A wrinkle-resistant blazer can be dressed up or down.
181,"How can I explore clothing options designed for specific travel destinations or experiences, allowing me to dress in harmony with my travel itinerary?","Dive into our 'Wanderlust Wardrobe' feature, offering clothing options designed for specific travel destinations or experiences. Whether you're headed to a tropical paradise or an urban adventure, find outfits that align with your travel itinerary, ensuring you're not only comfortable but also stylishly in sync with the spirit of your journey."
234,"Can I receive personalized advice for creating fashion-forward looks inspired by specific art movements or renowned artists, allowing me to embody artistic expressions?","Unlock our 'Artistry in Attire' feature for personalized advice on creating fashion-forward looks inspired by specific art movements or renowned artists. Whether you're drawn to surrealism or impressionism, our virtual stylist will curate outfits that embody artistic expressions, ensuring your attire becomes a canvas for showcasing your love for art through fashion."
204,Where can I find information about Autumn's commitment to fair trade practices and ethical sourcing of materials for its clothing collections?,"Learn about our commitment to fair trade practices on the 'Fair Fashion Pledge' page. Gain insights into how we ethically source materials for our clothing collections, ensuring fair wages and safe working conditions. Join us in supporting fair trade and ethical fashion, contributing to a more just and equitable global fashion industry."
868,Is there a limit to the number of items I can purchase?,"There is no set limit to the number of items you can purchase. However, larger orders may be subject to additional processing and shipping times."
463,How do I style a statement bag?,Let it be the focal point of your outfit by keeping the rest simple.
452,Can I wear white sneakers in the winter?,"Yes, white sneakers can be styled for colder months too."
285,Subtle and playful for relaxed days; any suggestions?,"Pale Pink & Seafoam Green Stripes is subtle and playful, perfect for those relaxed days."
311,Playful and whimsical for a lakeside picnic; any recommendations?,"Lemon & White Polka Dots is playful and whimsical, ideal for a picnic by the lake."
612,What are some tips for dressing for a snowy day?,"Wear layers of warm clothing. Choose fabrics that are insulating, such as wool or fleece. Avoid wearing anything too thin or too revealing. Stay warm and dry."
175,"How can I explore clothing options designed for specific home decor aesthetics, allowing me to coordinate my outfits with my living space?","Dive into our 'Home & Haute' feature, offering clothing options designed for specific home decor aesthetics. Whether your living space is minimalist or bohemian, find outfits that seamlessly coordinate with your home decor, allowing you to express a cohesive and stylish vibe that transcends from your wardrobe to your living space."
547,How do I dress for a summer barbecue?,Opt for a casual sundress or shorts with a breezy top.
49,What payment methods do you accept?,"We accept all major credit cards and debit cards, as well as secure online payment methods like MOMO, VNPAY"
13,Are there any restrictions on international shipping?,"We offer international shipping. Currently, our orders can only be shipped to North America, Europe, and Asia."
403,How do I dress for a casual dinner party?,Opt for a nice blouse with jeans or a casual dress.
580,How do I dress for a casual dinner party?,Opt for a nice blouse with jeans or a casual dress.
917,Do you offer price adjustments for items purchased during a sale?,"Unfortunately, we do not offer price adjustments for items purchased during a sale. Prices are subject to change, and sale prices are valid only during the specified sale period. We apologize for any inconvenience this may cause."
571,How do I style a statement scarf?,Let it be the focal point of your outfit by keeping the rest simple.
316,Edgy and playful for a night out with friends; what's your choice?,"Tangerine & Black Polka Dots is edgy and playful, perfect for a night out with friends."
962,Do you offer discounts for students or military personnel?,"Yes, we offer discounts for students and military personnel. Please visit our website's discount page to learn more about eligibility requirements and how to claim your discount. Thank you for your service and dedication!"
674,What’s the best way to wear a belt?,Cinch it at the waist to define your silhouette.
921,How can I request a price adjustment if an item goes on sale?,"If an item goes on sale shortly after you've made a purchase, you may be eligible for a price adjustment. Please contact me within the specified timeframe to request a price adjustment for your order."
801,How do I style a button-up shirt?,Tuck it into high-waisted pants or a skirt for a polished look.
231,"Can I receive notifications for exclusive virtual fashion shows or immersive digital experiences hosted by Autumn, providing a front-row seat to the latest collections?","Stay at the forefront of fashion by enabling notifications for exclusive virtual fashion shows and immersive digital experiences hosted by Autumn. Secure your front-row seat to witness the latest collections, innovative designs, and dynamic fashion presentations, ensuring you're part of the digital fashion spectacle. Follow us on Instagram, Facebook, and TikTok for event announcements."
520,How do I style a statement scarf?,Let it be the focal point of your outfit by keeping the rest simple.
898,How can I view my account details?,"You can view your account details, including order history, billing information, and saved addresses, by logging into your account and accessing the corresponding sections in the ""My Account"" dashboard."
783,How do I dress for a day at the races?,A sundress or a chic jumpsuit with a fascinator.
47,What type of clothes does Autumn sell?,"We focus on trendy summer and autumn styles, inspired by popular trends on TikTok and Facebook. We cater to a wide range of customers, from teens to young adults and even middle-aged individuals who enjoy staying up-to-date with fashion."
12,Do you have a size guide for your clothing?,"Yes, you can find a size guide on our website to help you choose the right fit."
220,Can I receive personalized advice for creating fashion-forward looks inspired by specific natural elements or landscapes?,"Immerse yourself in our 'Nature's Palette' feature for personalized advice on creating fashion-forward looks inspired by specific natural elements or landscapes. Whether it's the calming hues of the ocean or the vibrant tones of a sunset, our virtual stylist will curate outfits that capture the essence of your favorite natural inspirations, allowing you to wear the beauty of nature with style."
760,Can I wear a hat indoors?,It's considered polite to remove your hat indoors.
614,Choose breathable fabrics like cotton or linen.,Opt for natural fabrics to stay comfortable.
470,Can I wear a blazer with shorts?,"Yes, it's a trendy and chic combination."
724,Can I mix patterns in my outfit?,"Yes, just ensure they share a common color palette."
271,Earthy and harmonious for casual fall looks; what do you suggest?,Mustard Yellow & Olive Green gives an earthy and harmonious touch for casual fall style.
162,"How can I explore clothing options designed for specific occasions, such as beach vacations or poolside lounging?","Navigate our 'Sun-Kissed Styles' feature, where you can explore clothing options designed for specific occasions, from beach vacations to poolside lounging. Find curated selections that capture the essence of sun-soaked moments, ensuring you're fashionably prepared for relaxing and stylish escapes under the sun."
250,Any suggestions for a beachy vibe outfit this summer?,Dive into Mint Green & Coral for a refreshing and vibrant beachy look.
439,How do I style a wrap dress?,Cinch it at the waist with a belt and add heels for a polished look.
540,What's a stylish yet comfortable outfit for work?,Try a shift dress with ballet flats or low-heeled pumps.
362,Can I wear a tie with a casual shirt?,"Yes, it can add a touch of sophistication to the look."
6,Are your clothes sustainable and eco-friendly?,We are committed to sustainability and offer eco-friendly options in our collection.
925,Are there any restrictions on using discount codes on certain brands or collections?,"Some discount codes may have restrictions on use, including limitations on applying them to specific brands or collections. Please review the terms and conditions of the discount code before applying it at checkout."
85,How does Autumn handle fashion trends that receive mixed reviews from customers?,"We appreciate diverse opinions! If a fashion trend receives mixed reviews, we carefully analyze customer feedback. While not every trend may resonate with everyone, we consider constructive feedback to refine our offerings."
694,How do I care for delicate fabrics?,Follow the care instructions on the garment’s label and consider handwashing.
18,Can I request a personalized styling recommendation?,"Absolutely! Contact our styling team, and they'll assist you based on your preferences."
959,Can I return or exchange items purchased during a sale?,"Yes, items purchased during a sale are eligible for return or exchange according to our standard return policy. Please initiate the return or exchange process through your account, and we'll assist you with the return or exchange according to our policy."
246,"How can I contribute to Autumn's initiatives to support local charities and community projects, ensuring fashion becomes a vehicle for positive social impact?","Learn about our community support initiatives on the 'Fashion for Good' page. Discover how you can contribute to Autumn's initiatives to support local charities and community projects, ensuring fashion becomes a vehicle for positive social impact. From charity collections to partnerships with local organizations, join us in making a difference through the power of fashion."
806,What's a versatile piece of clothing for women?,A little black dress that can be dressed up or down.
20,What's the process for canceling an order?,"You can cancel your order within 8 hours of placing it. Order Cancellation Process:
1.Log in to your account on our website.
2.Navigate to the ""Order History"" section.
3.Locate the order you wish to cancel.
4.Click on the ""Cancel Order"" button.
5.Provide a reason for cancellation (optional).
6.Confirm the cancellation.
7.You will receive a confirmation email once the cancellation is processed."
36,Are there any exclusive online discounts?,Check our online store for exclusive discounts that may not be available elsewhere.
510,What's a trendy shoe style for men?,Chelsea boots with a sleek silhouette are fashionable.
671,How can I make a basic outfit more interesting?,Experiment with textures like denim or velvet.
222,"Can I explore clothing options inspired by mythical creatures or folklore, bringing a touch of fantasy into my wardrobe?","Embark on a mythical journey with our 'Fantasy Fusion' collection, featuring clothing options inspired by mythical creatures and folklore. Whether it's the elegance of unicorns or the mystique of dragons, this collection allows you to bring a touch of fantasy into your wardrobe, creating looks that transport you to enchanting realms with style."
543,What's a versatile piece of clothing for a beach vacation?,"A sarong that can be worn as a dress, skirt, or shawl."
761,What's a trendy shoe style for men?,Chelsea boots are a versatile and stylish choice.
393,What's a versatile piece of clothing for a night out?,A little black dress that can be dressed up or down.
617,Consider the weather before choosing your outfit.,Dress accordingly to stay comfortable outdoors.
846,What are the latest fashion trends?,"Keep up with the latest trends by reading fashion magazines, following fashion bloggers, and shopping at trendy stores."
194,"How can I explore clothing options designed for specific outdoor adventures or nature retreats, ensuring I'm both stylish and comfortable?","Elevate your outdoor wardrobe with our 'Adventure Attire' collection, offering clothing options designed for specific outdoor adventures or nature retreats. From hiking essentials to camping chic, this collection ensures you're both stylish and comfortable, allowing you to embrace the beauty of the great outdoors while expressing your adventurous fashion flair."
667,What shoes go well with a casual dress?,Sneakers or sandals can give a laid-back vibe.
426,What's a versatile piece of clothing for women?,A tailored blazer that can be dressed up or down.
995,Can I request a refund for an item if I change my mind?,"If you change your mind about an item and would like to request a refund, we can not help you."
899,Are there any restrictions on using store credit for online purchases?,"Sorry, my website does not currently support this feature. We will update in the future."
338,Suggestions for a bold and vibrant statement look?,Emerald Green & Fuchsia is eye-catching and perfect for making a statement.
172,Can I explore clothing options designed for specific weather moods or atmospheric vibes?,"Immerse yourself in our 'Weather Whimsy' feature, offering clothing options designed for specific weather moods or atmospheric vibes. Whether you're chasing the sun with bright summer styles or embracing cozy knits for rainy days, this feature ensures your wardrobe is attuned to the atmospheric nuances, allowing you to express your weather-inspired fashion sense."
102,Is there a way to preview upcoming collections before they launch?,"Get a sneak peek at upcoming collections by visiting the ""Coming Soon"" section on our homepage. Stay ahead of the fashion curve and bookmark your favorite pieces before their official launch."
418,How do I style a leather skirt?,Pair it with a fitted blouse or sweater and ankle boots.
525,What's a stylish yet practical outfit for a day of shopping?,"Try jeans, a comfortable top, and slip-on sneakers."
467,Can I wear sandals to a fancy dinner?,It's best to opt for more formal footwear for such occasions.
632,Don't forget to wear sunscreen to protect your skin.,"Sun protection is essential, even on cloudy days."
437,Can I wear a denim shirt with jeans?,"Yes, but make sure the denim shades are different."
84,"Can I find clothing options suitable for specific body shapes, such as apple or pear?","Yes, our size guide includes recommendations for different body shapes, such as apple or pear. Explore our 'Shape Me Chic' collection, where we provide styling tips and clothing options tailored to enhance and complement specific body shapes. Your confidence in your clothing choices is important to us, and we're here to help you find the perfect pieces for your unique silhouette."
628,Invest in a tailored blazer for a polished look.,A well-fitted blazer can instantly elevate an outfit.
415,How do I accessorize a little black dress?,Add a statement necklace or bold earrings for flair.
389,Can I wear a watch with a formal outfit?,"Yes, a sleek watch can add a touch of elegance."
879,Can I apply for a job at Autumn?,We're always on the lookout for talented individuals to join our team! Visit our Careers page: fb.com/abcxyz or contact us directly for information on current job openings and application procedures.
609,What are some tips for dressing for a cold day?,"Wear layers of warm clothing. Choose fabrics that are insulating, such as wool or fleece. Avoid wearing anything too thin or too revealing. Stay warm and dry."
798,How do I dress for a rooftop party?,Opt for a chic jumpsuit or a flowy blouse with trousers.
593,How do I style a statement bag?,Let it be the focal point of your outfit by keeping the rest simple.
262,What's a cheerful and optimistic palette for summer fun?,Cobalt Blue & Yellow brings cheerfulness and optimism for a summer full of fun.
567,What's a fashionable yet functional bag for men?,A leather messenger bag with multiple compartments.
276,Classy and romantic for fall dates; what do you recommend?,"Wine Red & White offers a classy and romantic palette, setting the mood for fall dates."
1001,What is your preferred name?,"My name is Aut, an AI-powered sales assistant. How can I help you today?"
118,"Can I find clothing options suitable for colder seasons, such as winter or fall, at Autumn?","Explore our 'Seasonal Coziness' collection for cozy and stylish options perfect for fall and winter. From warm knitwear to chic outerwear, find pieces that keep you fashionably snug during the colder months while embracing seasonal trends."
574,How do I dress for a casual outdoor wedding?,Opt for a sundress or a lightweight suit with loafers.
313,Nautical and chic for both genders; any recommendations?,"Seafoam Green & Cream Stripes is nautical and chic, suitable for both genders."
1003,What should I call you?,"Good morning! I am Aut, the intelligent sales assistant. I can help you shop online and find the best deals."
143,Can I create and share personalized fashion mood boards?,"Yes, unleash your creativity by using our 'Mood Board Creator.' Build personalized fashion mood boards by selecting items from our collections. Once created, share your unique style vision with friends, or keep them private for your inspiration. Express your fashion sense visually through curated mood boards on Autumn's platform."
29,How do you handle data privacy and security?,We prioritize the privacy and security of our customers. Our website uses secure protocols.
42,Can I change my shipping address after placing an order?,"Contact us immediately, and we'll do our best to update your shipping information."
245,"How can I explore clothing options designed for specific celestial events or cosmic inspirations, allowing me to dress in awe of the wonders of the universe?","Immerse yourself in our 'Celestial Charm' feature, offering clothing options designed for specific celestial events or cosmic inspirations. Whether it's a solar eclipse or the beauty of the night sky, this feature allows you to dress in awe of the wonders of the universe, ensuring your attire captures the enchantment of celestial charm with style."
466,How do I dress for a day of sightseeing?,"Opt for comfortable shoes, layered clothing, and a hat."
764,How do I dress for a job in a creative industry?,Express your personal style while still looking polished.
114,Is there a way to preview items in different colors on the website before making a purchase?,"Explore color options by clicking on the color swatches on each product page. Preview how items look in different colors, allowing you to make informed decisions and choose the perfect hue to complement your personal style."
655,Opt for timeless silhouettes that flatter your body type.,Timeless silhouettes never go out of style and enhance your figure.
273,Sophisticated and timeless for fall outfits; what's your pick?,"Rust & Navy is sophisticated and timeless, making it a perfect choice for fall looks."
866,Can I leave reviews for products on your website?,"Yes, you can leave reviews for products you've purchased by navigating to the product page and clicking on the ""Write a Review"" button. Your feedback helps other customers make informed purchasing decisions."
732,How do I style a midi skirt?,Pair it with a fitted top and heels for a chic look.
179,Can I receive personalized recommendations for clothing items that align with specific interior design color schemes?,"Experience the 'Color Harmony Homes' feature for personalized recommendations that align with specific interior design color schemes. Share details about your home's color palette, and our system will curate outfits that seamlessly coordinate with your interior design, creating a harmonious and stylish connection between your living space and wardrobe."
840,How do I dress for my body shape?,"Apple - A-line dresses, empire waist tops, and V-neck necklines. Pear - A-line skirts, straight-leg pants, and tops with volume at the shoulders. Hourglass - Fitted dresses, pencil skirts, and wrap tops. Rectangle - Belted dresses, peplum tops, and skinny jeans. Inverted Triangle - A-line dresses, skirts with volume, and off-the-shoulder tops."
227,Where can I find information about Autumn's commitment to showcasing diverse fashion styles and breaking traditional beauty standards?,"Learn about our commitment to diversity on the 'Style Spectrum' page. Discover how we showcase diverse fashion styles, breaking traditional beauty standards and celebrating individuality. Join us in promoting inclusivity and empowering individuals to express their unique style without conforming to conventional norms."
828,What are some essential fashion items for every wardrobe?,Some essential fashion items for every wardrobe include: A pair of well-fitting jeans A white button-down shirt A black blazer A little black dress A pair of neutral pumps A versatile jacket A statement necklace A pair of sunglasses A tote bag
896,How can I request a repair for a damaged item?,"If you receive a damaged item, please contact me immediately with photos of the damage. We'll assess the issue and provide instructions on how to proceed with a repair or replacement."
383,Can I wear a cardigan as a top?,"Yes, button it up and pair it with high-waisted bottoms."
104,"Can I customize my account settings, such as notifications and preferences?","Personalize your account settings by going to the ""Account Settings"" section. Adjust notification preferences, update your details, and tailor your Autumn experience to suit your individual preferences and needs"
548,Can I wear white after Labor Day?,"Absolutely, fashion rules have evolved, and white is now acceptable year-round."
