,Question,Answer
605,What are some tips for dressing for a job?,"Dress in professional attire that is clean, pressed, and fits well.  Avoid wearing anything too revealing or too casual. Make sure your hair is neat and styled, and your makeup is understated.  Pay attention to the details, such as your shoes, jewelry, and accessories."
643,Add layers with scarves for extra warmth and style.,Scarves are versatile accessories for any season.
650,Add interest to your outfit with textured accessories.,Textured accessories can elevate a simple outfit.
978,How can I find out about exclusive events or pop-up shops?,"You can find out about exclusive events or pop-up shops by subscribing to our newsletter and following us on social media platforms. We announce upcoming events and collaborations, as well as exclusive offers for our subscribers and followers."
368,Can I wear denim shorts to a fancy dinner?,It's best to opt for more formal attire for such occasions.
902,Can I request a refund for a defective item after the return period has expired?,If the refund period has expired. Unfortunately we cannot assist further.
109,"Can I filter clothing items by specific trends, such as those featured on TikTok or Facebook?","Absolutely! Use our ""Trend Filters"" on the homepage or category pages to filter items by specific trends inspired by TikTok, Facebook, and other popular platforms. Stay in style with the latest fashion trends curated just for you."
397,How do I dress for a casual outdoor wedding?,Opt for a sundress or a lightweight suit with loafers.
747,Can I wear socks with sandals?,"It's not a fashion faux pas anymore, go for it."
38,Can I request expedited shipping for my order?,"Yes, we offer expedited shipping options for faster delivery. Check our website for details."
441,What's a fashionable yet functional bag for men?,A leather messenger bag with multiple compartments.
864,How can I subscribe to your newsletter?,"Sorry, my website does not currently support this feature. We will update in the future."
713,What’s a versatile top for various occasions?,A classic button-up shirt can be dressed up or down effortlessly.
603,What are some tips for dressing for a business casual event?,"Dress in neat, clean, and well-fitting clothing. Avoid wearing anything too casual, such as jeans or shorts.  You can dress up your outfit with a blazer or cardigan. Pay attention to the details, such as your shoes, jewelry, and accessories."
619,Invest in quality basics that will last longer.,Quality over quantity is key for a timeless wardrobe.
943,How do I know if an item is restocked?,"You can sign up for restock notifications on the product page of the item you're interested in. Once the item is restocked, you'll receive an email notification informing you that it's available for purchase again."
867,How do I know if an item is in stock?,"You can check the availability of an item by visiting the product page. If an item is out of stock, you'll see a notification indicating its current status."
266,A timeless combination for a classic and bold look; what do you recommend?,Red & White is a timeless combo that exudes boldness and classic elegance.
918,Can I change the size or color of an item in my order?,"Once an order is placed, changes to the size or color of items may not be possible. However, you can contact me for assistance, and we'll do our best to accommodate your request if the order hasn't been processed yet."
24,Do you collaborate with influencers?,"Yes, we love collaborating with influencers. Reach out to us if you're interested."
477,What's a versatile piece of clothing for men?,A tailored blazer that can be dressed up or down.
430,How do I accessorize a plain dress?,"Add a statement belt, colorful scarf, or chunky jewelry."
203,"Can I explore clothing options designed for specific lunar phases or celestial aesthetics, allowing me to express my connection with the cosmos?","Immerse yourself in our 'Celestial Threads' feature, offering clothing options designed for specific lunar phases or celestial aesthetics. Whether you're a moonchild or stargazer, find outfits that express your connection with the cosmos, ensuring you can wear your celestial spirit with style and embrace the magic of the night sky in your fashion choices."
429,What's a stylish yet practical outfit for traveling?,"Try leggings, a comfortable top, and a lightweight jacket."
387,What's a classic piece of outerwear for women?,A trench coat is timeless and versatile.
542,Can I wear black to a wedding?,"Yes, as long as it's not against the couple's wishes."
230,"How can I explore clothing options designed for specific weather phenomena or atmospheric inspirations, ensuring my attire reflects the beauty of nature?","Dive into our 'Elemental Elegance' feature, offering clothing options designed for specific weather phenomena or atmospheric inspirations. Whether it's the gentle rain of spring or the warm glow of a sunset, this feature ensures your attire reflects the beauty of nature, allowing you to step into the world with a sense of elemental elegance and style."
329,What colors are trendy this summer?,Light & Airy combos like White & Sky Blue or Mint Green & Coral are in! 🌞
8,Can I track my order after it's been shipped?,"Yes, you'll receive a tracking number once your order is shipped for easy monitoring."
412,How do I style a denim jacket for fall?,Layer it over a cozy sweater with jeans and ankle boots.
461,Can I wear a tie with a casual outfit?,"Yes, it can add a touch of sophistication to the look."
300,Warm and cozy for fall layering; what's your go-to suggestion?,"Honey & Wheat is warm and cozy, making it perfect for layering up during the fall."
411,What's a classic piece of jewelry for women?,Diamond studs are timeless and versatile.
708,How do I dress for a casual Friday at work?,Opt for smart-casual attire like dark jeans paired with a blouse and blazer.
14,Can I modify my order after placing it?,"Unfortunately, once an order is placed, modifications are not possible. You can cancel the order then make a new one"
268,Vibrant and unexpected for a playful look; what's your take?,"Purple & Turquoise offers vibrancy and unexpectedness, perfect for a playful ensemble."
200,"How can I explore clothing options designed for specific historical eras or vintage aesthetics, allowing me to step back in time with style?","Dive into our 'Timeless Elegance' collections, where you can explore clothing options designed for specific historical eras or vintage aesthetics. Whether it's the roaring twenties or the swinging sixties, these collections allow you to step back in time with style, curating looks that capture the timeless elegance of your favorite historical periods."
662,Pay attention to the quality of your fabrics for long-lasting clothing.,Quality fabrics ensure durability and comfort in your clothing.
984,Can I request a refund for an item with a minor defect?,"If you receive an item with a minor defect and wish to request a refund, please me with details of the defect and your order information. We'll assess the issue and provide assistance with your refund request."
145,How can I navigate the 'Mix & Match' feature for creating customized outfits?,"Dive into our 'Mix & Match' feature on the homepage. Select various tops, bottoms, and accessories, and see them come together in real-time to create customized outfits. Experiment with different combinations until you find the perfect ensemble that suits your style, ensuring a personalized and creative shopping experience."
613,What are some tips for dressing for a sunny day?,Wear sunscreen to protect your skin from the sun. Wear a hat to keep your head cool. Choose sunglasses to protect your eyes from the sun. Stay hydrated and cool.
966,Can I use multiple payment methods for a single order?,"No, currently we only support cash payment methods"
600,What are some tips for dressing for a first date?,Dress in something that makes you feel confident and attractive. Choose an outfit that is appropriate for the occasion and the location. Don't overdo it with the makeup or jewelry. Pay attention to your body language and make eye contact.
60,Can I request a callback from customer support instead of emailing?,"While we primarily handle inquiries through email, we understand the importance of convenience. We are actively exploring options to introduce callback services for customer support in the future. In the meantime, feel free to reach out to us via email, and our dedicated support team will respond promptly to assist you with any questions or concerns you may have."
538,How do I style a denim jacket for fall?,Layer it over a cozy sweater with jeans and ankle boots.
602,What are some tips for dressing for a funeral?,"Dress in conservative attire that is dark in color. Avoid wearing anything too flashy or revealing. Keep your makeup and jewelry simple. Pay attention to the details, such as your shoes and accessories."
390,What's a chic outfit for a cocktail party?,A sleek cocktail dress or a tailored jumpsuit.
359,Can I wear a hat to a formal event?,It's best to avoid hats unless it's part of the attire.
767,How do I style a chambray shirt?,Pair it with white jeans or a skirt for a fresh look.
1,How can I provide feedback on my shopping experience?,You can share your feedback on our website or contact our customer support team.
138,How can I explore clothing options suitable for creating themed outfits or costume looks?,"Unleash your creativity with our 'Themed Ensembles' feature, where you can explore clothing options suitable for creating themed outfits or costume looks. Whether you're attending a costume party or embracing a specific theme, this feature provides curated selections to help you bring your themed fashion visions to life."
983,How can I stay informed about product restocks?,"You can sign up for restock notifications on the product page of the item you're interested in. Once the item is restocked, you'll receive an email notification informing you that it's available for purchase again."
277,Rich and unexpected for making a statement; what's your suggestion?,"Chocolate Brown & Teal brings richness and unexpectedness, perfect for making a statement."
125,How can I participate in exclusive pre-order opportunities for upcoming collections?,Stay ahead of the fashion curve by participating in exclusive pre-order opportunities. Check the 'Pre-Order' section on our homepage for upcoming collection details and secure your favorite pieces before they officially launch. Enjoy the privilege of being among the first to own the latest and trendiest styles.
678,How do I mix patterns without clashing?,Stick to a cohesive color palette and vary the scale of patterns.
791,What's a timeless accessory for women?,"A simple, elegant watch never goes out of style."
164,"How can I explore clothing options designed for specific fashion aesthetics, such as athleisure or streetwear styles?","Immerse yourself in our 'Urban Edge' collections, where you can explore clothing options designed for specific fashion aesthetics, from athleisure to streetwear styles. Whether you're embracing comfort with an athleisure vibe or making a statement with street-inspired looks, these collections cater to diverse urban style preferences."
821,What's a versatile piece of clothing for travel?,A convertible dress that can be worn multiple ways.
480,What's a chic outfit for a dinner with colleagues?,Try a blouse with tailored trousers and heels.
484,How do I dress for a beach wedding?,"Opt for a flowy maxi dress in light, breathable fabric."
623,Coordinate your outfit with complementary colors.,Choose colors that enhance each other.
113,How can I share my experience with Autumn on social media and potentially be featured on your official channels?,"Share your Autumn experience by tagging us on TikTok and Facebook or using our dedicated hashtag. Your photos and stories may be featured on our official channels, showcasing your unique style and contributing to our vibrant Autumn community."
243,"Can I explore clothing options designed for specific floral themes or botanical inspirations, allowing me to dress in harmony with the beauty of nature?","Dive into our 'Botanical Blooms' feature, offering clothing options designed for specific floral themes or botanical inspirations. Whether it's blooming flowers or lush greenery, this feature ensures your attire aligns with the beauty of nature, allowing you to dress in harmony with floral elegance and botanical charm."
1008,What can I call your store?,You can call our store Autumn.
151,Can I receive recommendations for versatile wardrobe staples that seamlessly transition between seasons?,"Explore our 'Seasonless Staples' feature, providing recommendations for versatile wardrobe staples that seamlessly transition between seasons. From classic trench coats to timeless denim, these essential pieces ensure you're prepared for any weather, allowing you to effortlessly maintain a stylish and adaptable wardrobe throughout the year."
698,How do I dress appropriately for a formal event?,Opt for a floor-length gown or a tailored suit.
92,Can I save multiple shipping addresses in my account?,"Yes, you can save multiple shipping addresses in your account for convenience. Manage your addresses in the ""Address Book"" section to streamline the checkout process for different delivery locations."
844,How do I build a capsule wardrobe?,"Start with a neutral color palette, add a few pops of color, and mix and match pieces to create multiple outfits."
355,How do I style a jumpsuit for evening wear?,Add statement jewelry and heels to elevate the look.
968,How can I find out about upcoming sales and promotions?,You can stay informed about upcoming sales and promotions by subscribing to our newsletter and following us on social media platforms such as Instagram and Facebook. We regularly announce exclusive offers and discounts to our subscribers and followers.
149,Can I find clothing options suitable for embracing specific color psychology principles?,"Immerse yourself in our 'Color Therapy' collection, where you can explore clothing options inspired by color psychology principles. Whether you seek energy, calm, or creativity, this collection curates items that align with specific color meanings, allowing you to express your emotions and embrace the transformative power of color in your fashion choices."
83,How does Autumn handle issues related to incorrect orders or missing items?,"In the rare instance of incorrect orders or missing items, contact our customer support team immediately with details about the issue. We'll conduct a thorough investigation and take swift action to rectify any errors, ensuring that you receive the correct items and have a positive shopping experience with Autumn."
124,Are there any behind-the-scenes glimpses of Autumn's fashion shoots and design process?,"Immerse yourself in the creative process by following our social media channels. We occasionally share behind-the-scenes glimpses of fashion shoots, design sessions, and the making of our collections. Get an insider's view of the Autumn world and witness the passion that goes into creating each stylish piece."
257,Any playful and casual combos for everyday wear?,"Mustard Yellow & Denim is playful and casual, making it perfect for everyday adventures."
642,Choose wrinkle-resistant fabrics for travel-friendly clothing.,Wrinkle-free fabrics keep you looking polished on the go.
154,"How can I explore clothing options designed for specific occasions, such as date nights or weekend getaways?","Navigate our 'Occasion Edit' feature, where you can explore clothing options designed for specific occasions, from romantic date nights to adventurous weekend getaways. Find curated selections that cater to the unique style demands of various occasions, ensuring you're ready to make a statement and feel confident in any setting."
853,How can I track my order?,"Currently, my website does not support the order tracking feature."
483,What's a trendy shoe style for women?,Chunky sneakers with platform soles are in fashion.
353,Can I wear a statement belt with a dress?,"Yes, it can add definition to your waistline."
589,How do I style a denim jacket for fall?,Layer it over a cozy sweater with jeans and ankle boots.
419,Can I wear flip-flops to a casual dinner?,"It depends on the ambiance, but closed-toe shoes are often more appropriate."
292,Striking and modern for a night out; what's your go-to choice?,"Hot Pink & Black is striking and modern, perfect for standing out on a night out."
753,What's a trendy accessory for women?,A mini backpack adds a fun touch to any outfit.
170,How can I explore clothing options suitable for a professional yet comfortable work-from-home wardrobe?,"Elevate your work-from-home wardrobe with our 'Comfort Chic' collection, offering clothing options suitable for a professional yet comfortable atmosphere. From polished loungewear to stylish Zoom-meeting attire, this collection ensures you stay both productive and fashion-forward while working remotely."
586,How do I dress for a beach wedding?,"Opt for a flowy maxi dress in light, breathable fabric."
50,What if I receive a damaged or incorrect item?,Please contact our customer support team as soon as possible if you receive a damaged or incorrect item. We will be happy to assist you with a replacement or refund.
399,What's a stylish yet practical outfit for a day of shopping?,"Try jeans, a comfortable top, and slip-on sneakers."
274,Rich and elegant for special occasions in fall; any suggestions?,"Plum & Camel exudes richness and elegance, making it ideal for special fall events."
916,Are there any restrictions on returning worn or damaged items?,"We cannot accept returns for items that have been worn, used, or damaged, unless they are defective or damaged upon receipt. Please review our return policy for detailed information on eligibility criteria for returns and exchanges."
183,Can I receive personalized advice for creating fashion-forward looks inspired by specific natural elements or landscapes?,"Immerse yourself in our 'Nature's Palette' feature for personalized advice on creating fashion-forward looks inspired by specific natural elements or landscapes. Whether it's the calming hues of the ocean or the vibrant tones of a sunset, our virtual stylist will curate outfits that capture the essence of your favorite natural inspirations, allowing you to express your connection with the beauty of nature through fashion."
130,How can I explore clothing options inspired by cultural or artistic movements?,"Immerse yourself in our 'Artistic Expressions' collection, where you can discover clothing options inspired by cultural and artistic movements. From abstract prints to culturally influenced designs, this collection offers a unique blend of art and fashion, allowing you to express your creativity through your clothing choices."
601,What are some tips for dressing for a wedding?,"Dress in formal attire that is appropriate for the time of day and the location of the wedding.  Avoid wearing anything too white, too black, or too revealing.  If you are a guest, be sure to coordinate your outfit with the wedding colors. Pay attention to the details, such as your shoes, jewelry, and accessories."
315,Graphic and impactful for a statement look; any recommendations?,"Emerald Green & Fuchsia Stripes is graphic and impactful, perfect for making a statement."
65,"Can I purchase a gift card for someone special, and how are they delivered?","Yes, you can share the joy of fashion with a gift card! Purchase a gift card on our website, and it will be delivered electronically to the email address you provide during the checkout process. Gift cards are a thoughtful way to let your loved ones explore and choose their favorite items from our collection, ensuring a personalized and stylish gift."
558,What's a classic piece of outerwear for men?,A well-fitted trench coat adds sophistication to any outfit.
937,How can I request a refund for an item purchased with a gift card?,"If you paid for an item with a gift card and would like to request a refund, the refund will be issued to the original gift card used for the purchase. You'll receive an email notification once the refund has been processed."
267,Edgy and modern; any suggestions for adventurous styles?,Black & Neon Green brings an edgy and modern touch for those with adventurous style.
884,How can I share feedback or suggestions for improving your website?,We value your input! You can share feedback or suggestions for improving our website by emailing feedback@aut.clothes.com or using the contact form available on our website. We appreciate your contributions to enhancing our service.
616,Invest in a versatile black dress for any occasion.,A classic black dress can be dressed up or down.
186,Can I receive updates on fashion philanthropy initiatives or charitable partnerships undertaken by Autumn to make a positive impact on society?,"Stay informed about our philanthropic efforts and charitable partnerships by subscribing to our 'Fashion with Purpose' newsletter. Receive updates on initiatives that make a positive impact on society, ensuring you're aware of the meaningful contributions and positive change fostered by Autumn in collaboration with various charitable organizations."
551,Can I wear sneakers with a suit?,It's unconventional but can work for a more casual setting.
229,How can I contribute to Autumn's initiatives to support sustainable fashion movements and advocate for ethical practices in the industry?,"Explore our 'Sustainable Steps' guide in the 'Green Living' section to learn how to contribute to sustainable fashion movements and advocate for ethical practices in the industry. Discover tips for mindful fashion consumption, supporting eco-friendly brands, and participating in movements that promote positive change in the fashion landscape. Join us in making sustainable steps toward a greener future."
823,Can I wear a tie with a casual outfit?,"Yes, it can add a touch of sophistication to the look."
745,What should I wear to a black-tie event?,A floor-length gown or a sophisticated suit and tie.
248,"Can I receive updates on Autumn's collaborations with emerging musicians or bands, ensuring I stay tuned to the intersection of music and fashion trends?","Stay in the musical groove by subscribing to our 'Soundstyle Synergy' newsletter. Receive updates on Autumn's collaborations with emerging musicians or bands, ensuring you stay tuned to the intersection of music and fashion trends. Be the first to explore collections influenced by the rhythm of music, celebrating the synergy between sound and style in the dynamic world of fashion."
738,What shoes should I wear with a jumpsuit?,Strappy heels or wedges can add elegance to the look.
374,Can I wear a statement necklace with a patterned top?,"Yes, as long as the colors complement each other."
947,How can I find the perfect size for me?,"You can refer to our size guide available on each product page to find the perfect fit for you. Additionally, me is available to assist you with sizing recommendations based on your measurements and preferences."
192,Can I explore clothing options inspired by classic literature or iconic literary characters?,"Embark on a literary fashion journey with our 'Timeless Tales' collection, featuring clothing options inspired by classic literature and iconic literary characters. Whether it's the elegance of Jane Eyre or the sophistication of Jay Gatsby, this collection allows you to dress in homage to timeless literary favorites, creating looks that capture the essence of literary sophistication."
566,Can I wear a blazer with chinos?,"Yes, it's a versatile and stylish combination."
342,What's a refreshing and unique summer statement?,Lime Green & Orange offers a refreshing and unique twist for a statement look.
330,Do you have breezy dresses for summer?,Absolutely! Check out our Lavender & Light Yellow combo for a dreamy look.
922,Can I request a return for a gift I received?,"Yes, you can request a return for a gift you received by contacting our customer support team with details of the gift and your order information. We'll provide instructions on how to proceed with the return process."
504,What's a stylish yet practical outfit for traveling?,"Try leggings, a comfortable top, and a lightweight jacket."
572,Can I wear a blazer with shorts?,"Yes, it's a trendy and chic combination."
595,What's a chic outfit for a cocktail party?,A sleek cocktail dress or a tailored jumpsuit.
502,How do I dress for a casual day out?,Go for jeans or leggings with a cozy sweater and sneakers.
81,Can I find clothing options suitable for maternity wear at Autumn?,"Yes, we have a dedicated 'Maternity Chic' collection for expectant mothers. Explore stylish and comfortable maternity wear designed to celebrate the beauty of pregnancy. From trendy maternity dresses to cozy essentials, our collection ensures that you can maintain your fashion-forward style throughout this special journey."
208,"Can I explore clothing options designed for specific fitness routines or wellness activities, ensuring I stay stylish while prioritizing my health?","Immerse yourself in our 'Active Living' feature, offering clothing options designed for specific fitness routines or wellness activities. Whether you're into yoga, running, or fitness classes, find outfits that seamlessly blend style and functionality, ensuring you stay fashionably active while prioritizing your health and well-being."
888,How can I request a refund for a duplicate subscription charge?,"If you've been charged for a subscription order more than once, please contact me with details of the duplicate charge and your account information. We'll investigate the issue and process a refund for any duplicate charges accordingly."
