,Question,Answer
512,Can I wear a denim shirt with jeans?,"Yes, but make sure the denim shades are different."
926,How can I request a refund for an item with a manufacturing defect?,"If you receive an item with a manufacturing defect, please contact me immediately with photos of the defect. We'll assess the issue and provide instructions on how to proceed with a refund or replacement."
810,How do I dress for a day at the beach?,Wear a swimsuit with a cover-up and flip flops.
949,Can I cancel or modify my order after it's been placed?,"Orders cannot be canceled or modified once they've been placed due to our fast processing times. However, you may be able to return or exchange the items once you receive them. Please refer to our return policy for more information."
819,How do I style a statement ring?,Wear it on its own to let it stand out.
618,Don't forget to accessorize with statement jewelry.,Accessories can elevate a simple outfit.
1011,What is the name of your shop?,You can call our store Autumn.
201,Can I receive personalized advice for creating fashion-forward looks inspired by specific cinematic genres or iconic movie characters?,"Unlock our 'Silver Screen Style' feature for personalized advice on creating fashion-forward looks inspired by specific cinematic genres or iconic movie characters. Whether you're drawn to film noir allure or superhero chic, our virtual stylist will curate outfits that bring the magic of the silver screen into your wardrobe with glamour and cinematic flair."
196,Where can I find information about Autumn's dedication to promoting body positivity and featuring diverse body shapes in its campaigns?,"Learn about our commitment to body positivity on the 'Inclusivity Spotlight' page. Discover how we celebrate diverse body shapes in our campaigns, ensuring representation that resonates with individuals of all sizes. Join us in promoting body positivity and fostering a fashion environment that embraces beauty in its many forms."
627,Dress in layers for unpredictable weather.,Be prepared for sudden changes in temperature.
599,What are some tips for dressing for a job interview?,"Dress in professional attire that is clean, pressed, and fits well.  Avoid wearing anything too revealing or too casual. Make sure your hair is neat and styled, and your makeup is understated.  Pay attention to the details, such as your shoes, jewelry, and accessories."
240,"Can I explore clothing options designed for specific artistic movements or avant-garde expressions, allowing me to push the boundaries of fashion and showcase my avant-garde style?","Immerse yourself in our 'Avant-Garde Aesthetics' feature, offering clothing options designed for specific artistic movements or avant-garde expressions. Whether you're a fan of surrealism or dadaism, this feature allows you to push the boundaries of fashion and showcase your avant-garde style, ensuring your wardrobe becomes a canvas for artistic exploration."
35,What's your policy on price adjustments?,"We don't offer price adjustments once an order is placed, so make sure to catch ongoing promotions."
454,How do I dress for a beach bonfire?,Opt for shorts or a flowy skirt with a cozy sweater.
28,Are there any opportunities for wholesale partnerships?,We're open to discussing wholesale partnerships. Contact us for more information.
384,What's a versatile piece of clothing for travel?,A convertible dress that can be worn multiple ways.
91,How do I contact customer support for assistance?,"Reach out to our customer support by clicking on the ""Contact Us"" link in the navigation menu. Fill out the form with your inquiry, and our support team will respond promptly to assist you with any concerns."
915,How can I request a return or exchange?,You can give me the problem you are expriencing. I will help you.
564,What's a classic accessory for men?,A quality leather belt adds a touch of refinement to any outfit.
993,Can I request a refund for an item if I received the wrong size?,"If you received the wrong size and would like to request a refund, please contact me within the specified return window with your order information. We'll assist you with the return and exchange process according to our policy."
592,What's a classic piece of outerwear for women?,A trench coat is timeless and versatile.
577,How do I style a jumpsuit for evening wear?,Add statement jewelry and heels to elevate the look.
630,Opt for versatile pieces that can be styled in multiple ways.,Versatile pieces maximize your wardrobe options.
413,Can I wear a skirt with sneakers?,"Yes, it's a fun and comfortable look for casual outings."
503,Can I wear white sneakers with a suit?,"Yes, if the suit is more casual and the sneakers are clean and sleek."
264,Striking and feminine for a night out; what's your go-to suggestion?,"Hot Pink & White is striking and feminine, perfect for turning heads on a night out."
32,What materials are commonly used in your clothing?,"Our clothing materials vary, but we strive for quality and comfort in each piece."
407,Can I wear a tie with a casual shirt?,"Yes, it can add a touch of sophistication to your look."
364,How do I dress for a casual date night?,Opt for jeans or a skirt with a cute top and flats.
408,What's a trendy shoe style for women?,Chunky sneakers with platform soles are in fashion.
770,How do I dress for a summer music festival?,Opt for lightweight clothing and comfortable shoes.
555,What's a stylish yet practical outfit for traveling?,"Try leggings, a comfortable top, and a lightweight jacket."
624,Layer clothing for both style and warmth.,Layering adds depth and dimension to your look.
22,Can I get a refund if I'm not satisfied with my purchase?,"Yes, we offer a satisfaction guarantee. Check our refund policy on the website."
99,How can I leave a review for a product I purchased?,"Share your thoughts by going to the product page of the item you bought. Scroll down to the reviews section and click on ""Write a Review"" to provide valuable feedback for our community."
420,What's a classic accessory for women?,A silk scarf adds sophistication to any outfit.
742,Can I wear sneakers with a dress?,"Yes, it's a trendy and comfortable choice."
576,What's a stylish yet practical outfit for a day of shopping?,"Try jeans, a comfortable top, and slip-on sneakers."
639,Consider the dress code when choosing your outfit.,Dress appropriately for the occasion and setting.
369,What's a classic piece of jewelry for men?,"A simple, elegant watch adds a touch of sophistication."
508,How do I style a patterned skirt?,Pair it with a solid-colored top and neutral accessories.
684,How do I choose the right sunglasses?,Consider your face shape and opt for frames that complement it.
626,Opt for comfortable shoes that support your feet.,Comfort is key when it comes to footwear.
911,Can I apply a gift card to my order after it's been placed?,"Unfortunately, we cannot apply a gift card to an order after it has been placed. Gift cards must be applied during the checkout process before completing your purchase. We apologize for any inconvenience this may cause."
908,Can I change the shipping method after placing an order?,"Currently, we only support one shipping method."
967,Can I apply for a job at Autumn if I live outside the country?,"Yes, we welcome applicants from around the world to join our team at Autumn. Please visit our careers page on our website to view available positions and submit your application online. We look forward to considering you for potential opportunities!"
927,Do you offer international returns and exchanges?,"Yes, we offer international returns and exchanges for eligible items. Please review our international return policy for detailed information on how to initiate a return or exchange from outside the country."
940,Can I request a refund for an item damaged during shipping?,"If your order arrives with items damaged during shipping, please contact me immediately with photos of the damage. We'll assess the issue and provide instructions on how to proceed with a refund or replacement."
169,Can I receive advice on creating fashion-forward outfits for specific cultural celebrations or festivals?,"Immerse yourself in our 'Festive Finesse' section, where you can receive advice on creating fashion-forward outfits for specific cultural celebrations and festivals. Whether it's Diwali, Lunar New Year, or Carnival, find curated selections that capture the festive spirit and allow you to express cultural joy through your fashion ensemble."
681,What’s the best way to wear stripes?,Pair them with solid colors for a balanced look.
573,What's a classic accessory for men?,A leather watch adds sophistication to any outfit.
669,What’s a versatile wardrobe staple?,A classic white button-down shirt can be dressed up or down.
765,Can I wear sneakers to work?,"It depends on your workplace culture, some allow it."
734,What should I wear to a concert?,Comfortable jeans and a graphic tee are perfect.
282,Classic and playful for both genders; any recommendations?,"Lemon & Navy Stripes is classic and playful, suitable for both genders in everyday wear."
214,"Can I explore clothing options designed for specific cultural festivals or global celebrations, allowing me to dress in festive and culturally rich attire?","Navigate our 'Global Festivities' feature, where you can explore clothing options designed for specific cultural festivals or global celebrations. Whether it's Diwali, Carnival, or Lunar New Year, find outfits that allow you to dress in festive and culturally rich attire, ensuring you celebrate diversity and showcase your appreciation for global traditions through fashion."
166,"How can I explore clothing options designed for specific occasions, such as beach vacations or poolside lounging?","Navigate our 'Sun-Kissed Styles' feature, where you can explore clothing options designed for specific occasions, from beach vacations to poolside lounging. Find curated selections that capture the essence of sun-soaked moments, ensuring you're fashionably prepared for relaxing and stylish escapes under the sun."
646,Invest in comfortable underwear for all-day comfort.,Comfort starts with the right foundation garments.
232,How can I contribute to Autumn's initiatives to support wildlife conservation and environmental protection through fashion choices?,"Learn about our wildlife conservation initiatives on the 'Wildlife Warriors' page. Discover how you can contribute to Autumn's efforts to support wildlife conservation and environmental protection through fashion choices. From animal-inspired collections to collaborations with conservation organizations, join us in making a positive impact on the planet and protecting our precious wildlife."
812,What's a classic accessory for women?,A strand of pearls adds elegance to any outfit.
472,How do I dress for a casual outdoor wedding?,Opt for a sundress or a lightweight suit with loafers.
647,Coordinate your outfit with the season's colors and trends.,Seasonal colors and trends can keep your look fresh.
802,Can I wear a blazer with jeans?,"Yes, it's a classic and versatile combination."
560,Can I wear a tie with a button-down collar?,"Yes, but it's best to choose a tie that isn't too wide."
970,Do you offer styling tips or outfit inspiration on your website?,"Yes, we provide styling tips and outfit inspiration on our website's blog and social media channels. You can find articles, lookbooks, and style guides featuring our latest collections and trends to help you create fashionable outfits."
583,How do I style a statement necklace?,"Pair it with a simple, solid-colored top or dress."
1002,Do you have a name?,"Nice to meet you! I am Aut, a sales chatbot created by Minh Quang. I can help you find products, answer questions, and complete orders."
587,Can I wear shorts to a semi-formal event?,"If they're tailored and paired with a dressy top, yes."
421,How do I dress for a summer barbecue?,Opt for a casual sundress or shorts with a breezy top.
137,Can I receive recommendations for on-trend hairstyles or beauty looks to complement my outfits?,"Discover on-trend hairstyles and beauty looks through our 'Beauty & Style' section. Explore guides and tutorials that offer inspiration for hair and makeup styles that perfectly complement your chosen outfits. Elevate your overall look with the latest beauty trends, creating a harmonious and fashionable ensemble."
817,Can I wear a scarf in the summer?,Opt for lightweight scarves in breathable fabrics.
357,What's a versatile piece of clothing for men?,A tailored blazer that can be dressed up or down.
865,Are there any promotions or discounts available?,We regularly offer promotions and discounts on our website. Check our homepage to stay updated on the latest deals and special offers.
156,Can I receive personalized gift recommendations for friends or loved ones based on their style preferences?,"Unlock the 'Gift Guru' feature for personalized gift recommendations. Provide information about your friend or loved one's style preferences, and our virtual gift guru will curate thoughtful and stylish gift suggestions tailored to their taste. Surprise them with a gift that reflects their unique style, creating memorable and cherished moments."
80,How does Autumn contribute to community engagement beyond the fashion realm?,"Community engagement is a core aspect of our values. Visit our 'Community Impact' page on the website to learn about the various initiatives and charities we support. We believe in making a positive impact beyond fashion, and your support as a customer contributes to the meaningful causes we champion."
964,How can I update my shipping address after placing an order?,"If you need to update your shipping address after placing an order, please contact me immediately with your order details. We'll do our best to update the shipping address before the order is processed and shipped."
581,Can I wear a hat to a formal event?,It's best to avoid hats unless it's part of the attire.
147,How can I receive personalized advice for styling based on my fashion preferences?,"Experience personalized styling advice by engaging with our 'Style Guru' chat feature. Answer a few quick questions about your fashion preferences, and our virtual style guru will provide tailored recommendations and tips to help you refine your personal style and create fashion-forward looks that resonate with you."
507,What's a classic piece of outerwear for men?,A well-fitted trench coat adds sophistication to any outfit.
863,Can I save items to my wishlist for later?,"Sorry, my website does not currently support this feature. We will update in the future."
858,Are there any shipping fees?,"From January 1, 2024, we are currently offering free shipping on all orders."
665,What colors complement my skin tone?,Earthy tones like olive and rust can be flattering.
297,Playful and unexpected for a fun and expressive look; any suggestions?,"Purple & Pink brings a playful and unexpected vibe, ideal for a fun and expressive look."
726,How do I dress for a winter wedding?,Opt for a long-sleeved dress and pair with boots.
69,"Can I find outfits suitable for specific occasions, such as weddings or parties?","Certainly! Our collection includes a variety of outfits suitable for different occasions, including weddings, parties, and casual gatherings. Navigate through our website's 'Occasion Wear' section to discover a curated selection of stylish outfits perfect for special events. From elegant dresses to sophisticated suits, we have a diverse range that caters to various occasions, ensuring you find the perfect ensemble for any celebration."
739,How do I style a statement piece of clothing?,Keep the rest of your outfit simple to let it shine.
487,How do I style a denim jacket for fall?,Layer it over a cozy sweater with jeans and ankle boots.
988,How can I find out about collaborations or limited-edition releases?,"You can find out about collaborations or limited-edition releases by subscribing to our newsletter and following us on social media platforms. We announce upcoming collaborations and releases, as well as exclusive offers for our subscribers and followers."
986,Are there any restrictions on using discount codes for new arrivals?,Discount codes may be applied to new arrivals depending on the terms and conditions of the specific code. Please review the details of the discount code to determine if it can be used for new arrivals at checkout.
318,Bold and graphic suitable for both genders; what's your pick?,"Cobalt Blue & Yellow Stripes is bold and graphic, suitable for both genders and summer adventures."
224,"Can I receive advice on creating fashion-forward looks for specific extracurricular activities or hobbies, such as book clubs or art workshops?","Immerse yourself in our 'Extracurricular Elegance' collection, offering advice on creating fashion-forward looks for specific extracurricular activities or hobbies, from book clubs to art workshops. Find outfits that seamlessly blend your passion for intellectual pursuits or creative endeavors with your fashion sense, ensuring you make a statement with style in every setting."
105,How do I navigate the website for a quick and efficient shopping experience?,"Navigate the website efficiently by using the intuitive menu and category links. Explore curated collections, utilize filters, and use the search bar for a seamless and enjoyable shopping journey at aut.clothes.com."
509,Can I wear a tie with a button-down collar?,"Yes, but it's best to choose a tie that isn't too wide."
755,What's a stylish outfit for a day at the office?,"Opt for a blouse, tailored pants, and pumps."
553,How do I dress for a casual day out?,Go for jeans or leggings with a cozy sweater and sneakers.
290,Contrasting and edgy for a bold summer statement; any suggestions?,"Tangerine & Black is contrasting and edgy, making it ideal for a bold summer statement."
471,What's a classic accessory for men?,A leather watch adds sophistication to any outfit.
123,How do I know if a clothing item is part of a limited edition or exclusive collection?,"Look for the 'Limited Edition' or 'Exclusive Collection' labels on product pages. These designations indicate special releases, ensuring you're aware of the unique and limited nature of the item. Stay tuned for these exclusive collections, as they often showcase distinctive styles not available elsewhere."
904,Can I change the delivery address after placing an order?,"Once an order is placed, changes to the delivery address may not be possible. However, you give me the orders id for assistance, and we'll do our best to accommodate your request."
979,Can I apply for a job at Autumn if I'm a stay-at-home parent?,"Yes, we welcome applicants from diverse backgrounds and lifestyles to apply for available positions at Autumn. We offer flexible work arrangements and remote opportunities to accommodate the needs of our team members."
210,"Can I receive updates on Autumn's participation in fashion events, runway shows, or collaborative projects with renowned fashion designers?","Stay in the fashion loop by subscribing to our 'Runway Revelations' newsletter. Receive updates on Autumn's participation in fashion events, runway shows, and collaborative projects with renowned fashion designers. Be the first to know about exclusive collections and the latest trends that emerge from our dynamic engagements in the fashion industry."
740,What's a classic accessory for men?,A quality leather belt can elevate any outfit.
913,Is there a way to expedite the processing of my order?,"While we strive to process orders as quickly as possible, we do not currently offer expedited processing options. If you have an urgent request, please contact me for assistance."
680,How can I elevate a casual look?,Swap out sneakers for ankle boots or loafers.
479,Can I wear a hat to a formal event?,It's best to avoid hats unless it's part of the attire.
455,Can I wear a scarf in the summer?,Opt for lightweight scarves in breathable fabrics.
485,Can I wear shorts to a semi-formal event?,"If they're tailored and paired with a dressy top, yes."
855,Do you have a mobile-friendly website?,"Yes, our website is fully optimized for mobile devices, allowing you to shop conveniently from your smartphone or tablet."
431,Can I wear a hat with a ponytail?,"Yes, choose a hat with a larger opening to accommodate the ponytail."
278,Bold and dramatic for edgy fall styles; any recommendations?,"Marigold & Black is bold and dramatic, ideal for embracing edgy fall styles."
263,Bold and refreshing for making a statement; any recommendations?,"Lime Green & Orange is bold and refreshing, ideal for those who love to stand out."
954,Do you offer alterations services for purchased items?,"We do not offer alterations services for purchased items at this time. However, we recommend seeking assistance from a local tailor or alterations specialist for any adjustments needed to ensure the perfect fit for your purchased items."
75,Can I expect exclusive discounts during seasonal transitions?,"Absolutely! Seasonal transitions bring new collections, and we celebrate these moments with exclusive discounts. Keep an eye on our website and subscribe to our newsletter for timely updates on special promotions during seasonal shifts, offering you fantastic savings on the latest trends."
777,How do I dress for a summer picnic?,Opt for a sundress or shorts and a breezy top.
37,How do you ensure the quality of your clothing?,We work closely with suppliers to maintain high-quality standards in our clothing.
906,Are there any restrictions on shipping to PO boxes?,We may have restrictions on shipping to PO boxes depending on the shipping carrier's policies and the destination address. Please check our shipping policy or give me specific problem you are expriencing.
987,Can I request a refund for an item purchased as a gift?,"If you received an item as a gift and wish to request a refund, please contact me with details of the gift and your order information. We'll assist you in processing the refund according to our return policy."
693,What’s a comfortable yet stylish shoe option?,Ballet flats are both chic and practical for everyday wear.
505,How do I accessorize a plain dress?,"Add a statement belt, colorful scarf, or chunky jewelry."
9,Are the colors of the clothes true to the pictures?,"We strive to ensure the colors are as accurate as possible, but there may be slight variations."
308,Sophisticated and unexpected for a formal fall event; any suggestions?,"Crimson & Grey is sophisticated and unexpected, making it perfect for a formal fall event."
111,Are there any virtual styling sessions or guides available to help me put together fashionable outfits with Autumn's clothing?,"Enhance your styling skills by exploring our ""Style Guides"" section. Find virtual styling sessions and guides to help you create on-trend outfits with ease, ensuring you make the most of your Autumn wardrobe for various occasions."
685,What’s a good alternative to jeans?,Try trousers in a neutral color for a more polished look.
946,Can I order custom sizing for certain items?,"Yes, we offer custom sizing for select items. Please contact me for assistance with placing a custom order, and we'll provide you with information on sizing options and the ordering process."
780,How do I style a floral skirt?,Pair it with a solid-colored top to balance the look.
247,"Can I explore clothing options designed for specific outdoor adventures or nature excursions, ensuring I'm both comfortable and stylish while embracing the great outdoors?","Navigate our 'Outdoor Odyssey' feature, where you can explore clothing options designed for specific outdoor adventures or nature excursions. Whether it's hiking, camping, or exploring, find outfits that prioritize both comfort and style, ensuring you're both prepared and fashionably attired for your outdoor escapades."
26,Can I use multiple discount codes on a single order?,"Generally, only one discount code can be used per order."
557,Can I wear a hat with a ponytail?,"Yes, choose a hat with a larger opening to accommodate the ponytail."
0,What age group does your store cater to?,"We cater to all age groups, from young teens to middle-aged individuals."
135,Can I receive early access to exclusive sales and promotions by joining the VIP club?,"Unlock exclusive benefits by joining our VIP club. Enjoy early access to sales, exclusive promotions, and special discounts reserved for VIP members. Sign up today to elevate your shopping experience and receive VIP treatment, ensuring you're always among the first to enjoy exciting offers and savings."
909,What should I do if I receive the wrong item?,"If you receive the wrong item, please contact me immediately with details of the issue. We'll investigate the matter and arrange for the correct item to be sent to you as soon as possible."
11,What payment methods do you accept?,"We accept major credit cards, PayPal, and other secure payment methods."
748,What's a chic outfit for a dinner date?,A little black dress with heels and statement jewelry.
288,Cheerful and bright for sunny days; what's your go-to recommendation?,"Apricot & White is cheerful and bright, bringing joy to your outfit on sunny days."
498,What's a trendy accessory for men?,A minimalist leather wallet with sleek lines.
664,Invest in a good quality umbrella for rainy days.,A sturdy umbrella will keep you dry and stylish in wet weather.
98,How to log out of the website?,"Here is how you can log out of the website:
Step 1: Go to My Profile.
Step 2: Choose Log Out at the bottom of the screen."
448,How do I dress for a casual day at the office?,"Opt for tailored trousers, a blouse, and loafers."
